{
  "$schema": "https://github.com/AmadeusITGroup/ai-primitives-hub/schemas/lockfile.schema.json",
  "bundles": {
    "acme-prompts": {
      "tools": {
        "kiro": {
          "files": [
            {
              "checksum": "sha256:2c26b46b68ffc68ff99b453c1d30413413422d706483bfa0f98a5e886266e7ae",
              "installedPath": ".kiro/steering/style.md"
            }
          ],
          "installedAt": "2026-10-24T10:00:00.000Z",
          "sourceId": "acme-github",
          "sourceType": "github",
          "version": "1.2.0"
        },
        "vscode": {
          "files": [
            {
              "checksum": "sha256:fcde2b2edba56bf408601fb721fe9b5c338d10ee429ea04fae5511b68fbf8fb9",
              "installedPath": ".github/prompts/my-prompt.prompt.md"
            }
          ],
          "futureEntryField": {
            "kept": true
          },
          "installedAt": "2026-10-24T10:00:00.000Z",
          "sourceId": "acme-github",
          "sourceType": "github",
          "version": "1.2.0"
        }
      }
    }
  },
  "generatedAt": "2026-10-24T10:00:00.000Z",
  "generatedBy": "ai-primitives-hub-cli@0.3.0",
  "level": "repository",
  "sources": {
    "acme-github": {
      "type": "github",
      "url": "https://github.com/acme/prompts"
    }
  },
  "version": "3.0.0"
}
